CompanyName,CompanyStateCode,CompanyIndustrialClassification,Website,Roles,LinkedIn
ZEWEB MEDIA PRIVATE LIMITED,DELHI,Business Services,https://support.google.com/websearch/answer/181196?hl=en-IN,"Analyst, Developer, Executive, Software Engineer",
INVOS RESEARCH & TECHNOLOGY PRIVATE LIMITED,DELHI,Business Services,https://support.google.com/websearch/answer/181196?hl=en-IN,,
STUDIO 38 MARKETING (OPC) PRIVATE LIMITED,DELHI,Business Services,https://support.google.com/websearch/answer/181196?hl=en-IN,"Analyst, Developer, Manager",
GEEKSQUADRON PRIVATE LIMITED,DELHI,Business Services,,,
VANINADH BUSINESS PRIVATE LIMITED,DELHI,Business Services,https://support.google.com/websearch/answer/181196?hl=en-IN,"Executive, Manager, Officer",
NORDFINN CONSULTANCY SERVICES PRIVATE LIMITED,DELHI,Business Services,,Manager,
PHALANX CATALYTIC SOLUTIONS PRIVATE LIMITED,DELHI,Business Services,,"Executive, Officer",
HEXAGON INFRASTRUCTURE & EDUCATION PRIVATE LIMITED,ASSAM,Business Services,,,
MLP RESEARCH (INDIA) PRIVATE LIMITED,MAHARASHTRA,Business Services,,,
EAGER TECHNOLOGY & EDUCATION SERVICES PRIVATE LIMITED,ASSAM,Business Services,https://support.google.com/websearch/answer/181196?hl=en-IN,,
JM OPTICAL FIBER SOLUTIONS PRIVATE LIMITED,MAHARASHTRA,Business Services,,,
ZINZID TECHNOLOGIES (OPC) PRIVATE LIMITED,ASSAM,Business Services,,,
OOFY-U INVESTMENT ADVISORS PRIVATE LIMITED,ASSAM,Business Services,https://support.google.com/websearch/answer/181196?hl=en-IN,Consultant,
RISETECH CREATION PRIVATE LIMITED,ASSAM,Business Services,https://support.google.com/websearch/answer/181196?hl=en-IN,,
KODE KRUNCH SOFTWARE PRIVATE LIMITED,MAHARASHTRA,Business Services,https://support.google.com/websearch/answer/181196?hl=en-IN,,
ALT-PAY TECHNOLOGIES PRIVATE LIMITED,MAHARASHTRA,Business Services,,,
SWIPENEST INNOVATIONS PRIVATE LIMITED,MAHARASHTRA,Business Services,,,
AURORA PACKERS PRIVATE LIMITED,ASSAM,Business Services,,,
FOUNDATION FOR INTEGRATED SUPPORT AND SOLUTION,ASSAM,Business Services,https://support.google.com/websearch/answer/181196?hl=en-IN,,
BOGAMATI ORGANIC PRIVATE LIMITED,ASSAM,Business Services,,,
